	ref_title	ref_context	ref_entry	abstract	intro	ref_link
95	When is undersampling effective in unbalanced classification tasks? In Machine Learning and Knowledge Discovery in Databases	[]	Andrea Dal Pozzolo, Olivier Caelen, and Gianluca Bontempi. 2015. When is undersampling effective in unbalanced classification tasks? In Machine Learning and Knowledge Discovery in Databases. Springer, 200–215.			http://scholar.google.com/scholar?hl=en&q=Andrea+Dal+Pozzolo%2C+Olivier+Caelen%2C+and+Gianluca+Bontempi.+2015.+When+is+undersampling+effective+in+unbalanced+classification+tasks%3F+In+Machine+Learning+and+Knowledge+Discovery+in+Databases.+Springer%2C+200%2D%2D215.
96	Evaluation of classifiers for an uneven class distribution problem	['As claimed by many authors <NO>, the use of plain accuracy (error) rates to evaluate the classification performance in imbalanced domains might produce misleading conclusions, since they do not take misclassification costs into account, are strongly biased to favor the majority class, and are sensitive to class skews.']	Sophia Daskalaki, Ioannis Kopanas, and Nikolaos M. Avouris. 2006. Evaluation of classifiers for an uneven class distribution problem. Appl. Artif. Intell. 20, 5 (2006), 381–417.			http://scholar.google.com/scholar?hl=en&q=Sophia+Daskalaki%2C+Ioannis+Kopanas%2C+and+Nikolaos+M.+Avouris.+2006.+Evaluation+of+classifiers+for+an+uneven+class+distribution+problem.+Appl.+Artif.+Intell.+20%2C+5+%282006%29%2C+381%2D%2D417.
97	The relationship between Precision-Recall and ROC curves	['Similar to AUC-ROC, an area under precision/recall curve (AUC-PR) can be used to indicate the detection ability of a classifier between precision and recall as a function of varying a decision threshold <NO>', 'For example, researchers have recently argued that precision-recall curves are preferable when dealing with highly skewed datasets <NO>.']	Jesse Davis, and Mark Goadrich. 2006. The relationship between Precision-Recall and ROC curves. ICML’06: Proc. of the 23rd Int. Conf. on Machine Learning (ACM ICPS). ACM, New York, NY, 233– 240.	Receiver Operator Characteristic (ROC) curves are commonly used to present results for binary decision problems in machine learning. However, when dealing with highly skewed datasets, Precision-Recall (PR) curves give a more informative picture of an algorithm’s performance. We show that a deep connection exists between ROC space and PR space, such that a curve dominates in ROC space if and only if it dominates in PR space. A corollary is the notion of an achievable PR curve, which has properties much like the convex hull in ROC space; we show an efficient algorithm for computing this curve. Finally, we also note differences in the two types of curves are significant for algorithm design. For example, in PR space it is incorrect to linearly interpolate between points. Furthermore, algorithms that optimize the area under the ROC curve are not guaranteed to optimize the area under the PR curve.	"In a binary decision problem, a classifier labels examples as either positive or negative. The decision made by the classifier can be represented in a structure known as a confusion matrix or contingency table. The confusion matrix has four categories: True positives (TP) are examples correctly labeled as positives. False positives (FP) refer to negative examples incorrectly labeled as positive. True negatives (TN) correspond to negatives correctly labeled as negative. Finally, false negatives (FN) refer to positive examples incorrectly labeled as negative.
A confusion matrix is shown in Figure 2(a). The confusion matrix can be used to construct a point in either ROC space or PR space. Given the confusion matrix, we are able to define the metrics used in each space as in Figure 2(b). In ROC space, one plots the False Positive Rate (FPR) on the x-axis and the True Positive Rate (TPR) on the y-axis. The FPR measures the fraction of negative examples that are misclassified as positive. The TPR measures the fraction of positive examples that are correctly labeled. In PR space, one plots Recall on the x-axis and Precision on the y-axis. Recall is the same as TPR, whereas Precision measures that fraction of examples classified as positive that are truly positive. Figure 2(b) gives the definitions for each metric. We will treat the metrics as functions that act on the underlying confusion matrix which defines a point in either ROC space or PR space. Thus, given a confusion matrix A, RECALL(A) returns the Recall associated with A."	https://doi.org/10.1145/1143844.1143874
98	A multistrategy approach for digital text categorization from imbalanced documents	[]	Marı́a Dolores Del Castillo, and José Ignacio Serrano 2004. A multistrategy approach for digital text categorization from imbalanced documents. ACM SIGKDD Explor. Newslett	The goal of the research described here is to develop a multistrategy classifier system that can be used for document categorization. The system automatically discovers classification patterns by applying several empirical learning methods to different representations for preclassified documents belonging to an imbalanced sample. The learners work in a parallel manner, where each learner carries out its own feature selection based on evolutionary techniques and then obtains a classification model. In classifying documents, the system combines the predictions of the learners by applying evolutionary techniques as well. The system relies on a modular, flexible architecture that makes no assumptions about the design of learners or the number of learners available and guarantees the independence of the thematic domain.	"HYCLA operates in two stages, learning and integration. In the learning stage, learners apply an evolutionary technique to obtain their own feature set, and then they are trained to obtain their classification model. In the integration stage, individual learned models are evaluated on a test set, and the predictions made are combined in order to achieve the best classification of test documents. The subsections below describe the modules and procedures of this system.
The underlying architecture of HYCLA can be instantiated to approach a different text mining task by upgrading its modules."	https://doi.org/10.1145/1007730.1007740
99	Overlap versus imbalance	[]	Misha Denil, and Thomas Trappenberg. 2010. Overlap versus imbalance. Advances in Artificial Intelligence. Springer, 220–231.			https://doi.org/10.1007/978-3-642-13059-5_22
100	MetaCost: A general method for making classifiers cost-sensitive	['One is to assign distinct costs to the classification errors <NO>.', 'MetaCost <NO> or cost sensitive boosting <NO>.', 'For example, the work on cost sensitive learning <NO> aimed at reducing total cost, and sampling approaches <NO> to favour the minority class are usually demonstrated with decision tree algorithms and/or naive Bayes.', 'For example, the work on cost sensitive learning <NO> aimed at reducing total cost, and sampling approaches <NO> to favour the minority class are usually demonstrated with decision tree algorithms and/or naive Bayes.', 'Algorithmic methods include adjusting the costs associated with misclassification so as to improve performance <NO>, shifting the bias of a classifier to favor the rare class <NO>, creating Adaboost-like boosting schemes <NO>, and learning from one class <NO>.', 'Moreover, Domingos <NO> reports that concerning concept learning problems, C4.', 'where P jjx ð Þ represents the probability of each class j for a given example x <NO>, <NO>.', 'Both of these classes have rich theoretical foundations that justify their approaches, with cost-sensitive dataspace weighting methods building on the translation theorem <NO>, and cost-sensitive Metatechniques building on the Metacost framework <NO>.', 'We additionally note that it is generally very straightforward to make hard-type classifiers provide softtype outputs based on the observations of the intrinsic characteristics of those classifiers <NO>, <NO>, <NO>, <NO>.', 'It is worth noting that the original MetaCost method <NO> does not explicitly manipulate the outputs of the classifier.']	Pedro Domingos. 1999. MetaCost: A general method for making classifiers cost-sensitive. KDD’99: Proceedings of the 5th International Conference on Knowledge Discovery and Data Mining. ACM Press, New York, NY, 155–164.			https://doi.org/10.1145/312129.312220
101	GP classification under imbalanced data sets: Active subsampling and AUC approximation	[]	John Doucette, and Malcolm I. Heywood. 2008. GP classification under imbalanced data sets: Active subsampling and AUC approximation. Genetic Programming. Springer, 266–277.			https://doi.org/10.5555/1792694.1792719
102	Evolutionary sampling and software quality modeling of high-assurance systems	[]	Dennis J. Drown, Taghi M. Khoshgoftaar, and Naeem Seliya. 2009. Evolutionary sampling and software quality modeling of high-assurance systems. IEEE Trans. Syst. Man Cybernet. A 39, 5 (2009), 1097– 1107.	Software quality modeling for high-assurance systems, such as safety-critical systems, is adversely affected by the skewed distribution of fault-prone program modules. This sparsity of defect occurrence within the software system impedes training and performance of software quality estimation models. Data sampling approaches presented in data mining and machine learning literature can be used to address the imbalance problem. We present a novel genetic algorithm-based data sampling method, named Evolutionary Sampling, as a solution to improving software quality modeling for high-assurance systems. The proposed solution is compared with multiple existing data sampling techniques, including random undersampling, one-sided selection, Wilson’s editing, random oversampling, cluster-based oversampling, Synthetic Minority Oversampling Technique (SMOTE), and Borderline-SMOTE. This paper involves case studies of two realworld software systems and builds C4.5and RIPPER-based software quality models both before and after applying a given data sampling technique. It is empirically shown that Evolutionary Sampling improves performance of software quality models for high-assurance systems and is significantly better than most existing data sampling techniques.		https://doi.org/10.1109/TSMCA.2009.2020804
103	Explicitly representing expected cost: An alternative to ROC representation	['Drummond and Holte <NO> introduced the cost space representation that allows for comparing different classifiers in terms of the expected cost.', 'We also implemented cost-curves over the range of PCF (+) established by varying C(+|−) and C(−|+) <NO>.', 'In order to provide a more comprehensive evaluation metric to address these issues, cost curves were proposed in <NO>, <NO>, <NO>.', 'such as ROC curve <NO> or cost curve <NO> can be used to', 'useful nontrivial classifiers can be identified <NO>.']	Chris Drummond, and Robert C. Holte. 2000. Explicitly representing expected cost: An alternative to ROC representation. Proceedings of the Sixth ACM SIGKDD International Conference on Knowledge Discovery and Data Mining. ACM, New York, NY, 198–207.	This paper proposes an alternative to ROC representation, in which the expected cost of a classi er is represented explicitly . This expected cost representation maintains many of the adv an tagesof R OCrepresen tation, but is easier to understand. It allows the experimenter to immediately see the range of costs and class frequencies where a particular classi er is the best and quantitatively how much better it is than other classi ers. This paper demonstrates there is a point/line duality between the tw o represen tations.A point in ROC space representing a classi er becomes a line segment spanning the full range of costs and class frequencies. This duality produces equivalen t operations in the tw o spaces, allowing most techniques used in ROC analysis to be readily reproduced in the cost space.	In this section we brie y review ROC analysis and how it is used in evaluating or comparing a classi er's performance. We then introduce our alternative dual representation, which maintains these advantages but by making explicit the expected cost is much easier to understand. In both representations, the analysis is restricted to two class problems which are referred to as the positive and negative class.	https://doi.org/10.1145/347090.347126
104	C4	[]	Chris Drummond, and Robert C. Holte. 2003. C4. 5, class imbalance, and cost sensitivity: Why under-sampling beats over-sampling. In Workshop on Learning from Imbalanced Datasets II, Vol. 11. Citeseer. James P. Egan. 1975. Signal detection theory and {ROC} analysis. (1975).			http://scholar.google.com/scholar?hl=en&q=Chris+Drummond+and+Robert+C.+Holte.+2003.+C4.+5%2C+class+imbalance%2C+and+cost+sensitivity%3A+Why+under-sampling+beats+over-sampling.+In+Workshop+on+Learning+from+Imbalanced+Datasets+II%2C+Vol.+11.+Citeseer.
105	The foundations of cost-sensitive learning	['As stated in <NO>, given a set of cost setups, the decisions are unchanged if each one in the set is multiplied by a positive constant or added with a constant.', 'Since boosting assigns higher weights to misclassified examples and minority class examples are those most likely to be misclassified, it stands to reason that minority class examples will receive higher weights during the boosting process, making it similar in many ways to cost-sensitive classification <NO> (a technique for alleviating the class imbalance problem that is not discussed in this paper).', 'Cost-sensitive learning <NO>, <NO> is another important class of class-imbalance learning methods.', 'Algorithmic methods include adjusting the costs associated with misclassification so as to improve performance <NO>, shifting the bias of a classifier to favor the rare class <NO>, creating Adaboost-like boosting schemes <NO>, and learning from one class <NO>.', 'Indeed, the motivation for attaining probability estimates is often to classify instances as belonging to the majority class only when we are quite sure of it (this is the basic idea behind cost-sensitive learning <NO>, <NO>).', 'where P jjx ð Þ represents the probability of each class j for a given example x <NO>, <NO>.', 'lished in <NO>, which generalizes the effects of decision tree', 'In this case cost-sensitivity was obtained by altering the ratio of positive to negative examples in the training data, or, equivalently, by adjusting the probability thresholds used to assign class labels <NO>.', '1 to account for the differences between the training distribution and the underlying distribution <NO>.', 'Elkan indicated <NO>, sampling can be done either randomly or deterministically.']	Charles Elkan. 2001. The foundations of cost-sensitive learning. IJCAI’01: Proc. of 17th Int. Joint Conf. of Artificial Intelligence, Vol. 1. Morgan Kaufmann Publishers, 973–978.			https://doi.org/10.5555/1642194.1642224
106	Adaptive oversampling for imbalanced data classification	[]	Şeyda Ertekin. 2013. Adaptive oversampling for imbalanced data classification. Information Sciences and Systems 2013. Springer, 261–269.			http://scholar.google.com/scholar?hl=en&q=%C5%9Eeyda+Ertekin.+2013.+Adaptive+oversampling+for+imbalanced+data+classification.+In+Information+Sciences+and+Systems+2013.+Springer%2C+261%2D%2D269.
107	Learning on the border: Active learning in imbalanced data classification	['For example, an SVM-based active learning approach for imbalanced datasets was proposed in <NO> and <NO>.', 'Recently, however, various issues on active learning from imbalanced data sets have been discussed in literature <NO>, <NO>, <NO>, <NO>.', '8 illustrates the motivation for the selection procedure for imbalanced data sets <NO>.', '<NO> and <NO> proposed an efficient SVM-based active learning method which queries a small pool of data at each iterative step of active learning instead of querying the entire data set.', '<NO> and <NO> also point out that the search process for the most informative instances can be computationally expensive because, for each instance of unseen data, the algorithm needs to recalculate the distance between each instance and the current hyperplane.', 'To solve this problem, they proposed a method to effectively select such informative instances from a random set of training populations to reduce the computational cost for large-scale imbalanced data sets <NO>, <NO>.', 'Data imbalance ratio within and outside the margin <NO>.']	Şeyda Ertekin, Jian Huang, Leon Bottou, and Lee Giles. 2007. Learning on the border: Active learning in imbalanced data classification. Proceedings of the Sixteenth ACM Conference on Conference on Information and Knowledge Management. ACM, New York, NY, 127–136.	This paper is concerned with the class imbalance problem which has been known to hinder the learning performance of classification algorithms. The problem occurs when there are significantly less number of observations of the target concept. Various real-world classification tasks, such as medical diagnosis, text categorization and fraud detection suffer from this phenomenon. The standard machine learning algorithms yield better prediction performance with balanced datasets. In this paper, we demonstrate that active learning is capable of solving the class imbalance problem by providing the learner more balanced classes. We also propose an efficient way of selecting informative instances from a smaller pool of samples for active learning which does not necessitate a search through the entire dataset. The proposed method yields an efficient querying system and allows active learning to be applied to very large datasets. Our experimental results show that with an early stopping criteria, active learning achieves a fast solution with competitive prediction performance in imbalanced data classification.	"Recent research on class imbalance problem has focused on several major groups of techniques. One is to assign distinct costs to the classification errors <NO>. In this method, the misclassification penalty for the positive class is assigned a higher value than that of the negative class. This method requires tuning to come up with good penalty parameters for the misclassified examples. The second is to resample the original training dataset, either by over-sampling the minority class and/or under-sampling the majority class until the classes are approximately equally represented <NO>. Both resampling methods introduce additional computational costs of data preprocessing and oversampling can be overwhelming in the case of very large scale training data. Undersampling has been proposed as a good means of increasing the sensitivity of a classifier. However this method may discard potentially useful data that could be important for the learning process therefore significant decrease in the prediction performance may be observed. Discarding the redundant examples in undersampling has been discussed in <NO> but since it is an adaptive method for ensemble learning and does not involve an external preprocessing step it can not be applied to other types of algorithms. Oversampling has been proposed to create synthetic positive instances from the existing positive samples to increase the representation of the class. Nevertheless, oversampling may suffer from overfitting and due to the increase in the number of
samples, the training time of the learning process gets longer. If a complex oversampling method is used, it also suffers from high computational costs during preprocessing data. In addition to those, oversampling methods demand more memory space for the storage of newly created instances and the data structures based on the learning algorithm (i.e., extended kernel matrix in kernel classification algorithms). Deciding on the oversampling and undersampling rate is also another issue of those methods. Another technique suggested for class imbalance problem is to use a recognition-based, instead of discrimination-based inductive learning <NO>. These methods attempt to measure the amount of similarity between a query object and the target class, where classification is accomplished by imposing a threshold on the similarity measure. The major drawback of those methods is the need for tuning the similarity threshold of which the success of the method mostly relies on. On the other hand, discrimination-based learning algorithms have been proved to give better prediction performance in most domains.
In <NO> the behavior of Support Vector Machines (SVM) with imbalanced data is investigated. They applied <NO>’s SMOTE algorithm to oversample the data and trained SVM with different error costs. SMOTE is an oversampling approach in which the minority class is oversampled by creating synthetic examples rather than with replacement. The k nearest positive neighbors of all positive instances are identified and synthetic positive examples are created and placed randomly along the line segments joining the k minority class nearest neighbors. Preprocessing the data with SMOTE may lead to improved prediction performance at the classifiers, however it also brings more computational cost to the system for preprocessing and yet the increased number of training data makes the SVM training very costly since the training time at SVMs scales quadratically with the number of training instances. In order to cope with today’s tremendously growing dataset sizes, we believe that there is a need for more computationally efficient and scalable algorithms. We show that such a solution can be achieved by using active learning strategy."	https://doi.org/10.1145/1321440.1321461
108	Active learning for class imbalance problem	['For example, an SVM-based active learning approach for imbalanced datasets was proposed in <NO> and <NO>.', 'This algorithm locates the “most informative” sample by evaluating a small fixed number of randomly selected examples instead of the entire dataset <NO>.', 'Recently, however, various issues on active learning from imbalanced data sets have been discussed in literature <NO>, <NO>, <NO>, <NO>.', 'SVM-based active learning aims to select the most informative instances from the unseen training data in order to retrain the kernel-based model <NO>, i.', '<NO> and <NO> proposed an efficient SVM-based active learning method which queries a small pool of data at each iterative step of active learning instead of querying the entire data set.', '<NO> and <NO> also point out that the search process for the most informative instances can be computationally expensive because, for each instance of unseen data, the algorithm needs to recalculate the distance between each instance and the current hyperplane.', 'To solve this problem, they proposed a method to effectively select such informative instances from a random set of training populations to reduce the computational cost for large-scale imbalanced data sets <NO>, <NO>.']	Şeyda Ertekin, Jian Huang, and C. Lee Giles. 2007. Active learning for class imbalance problem. Proceedings of the 30th Annual International ACM SIGIR Conference on Research and Development in Information Retrieval. ACM, New York, NY, 823–824.	The class imbalance problem has been known to hinder the learning performance of classification algorithms. Various real-world classification tasks such as text categorization suffer from this phenomenon. We demonstrate that active learning is capable of solving the problem.	"The basic SVM based active learning selects the closest instance to the current hyperplane from the unseen training data and adds it to the training set to retrain the model. In classical active learning <NO>, the search for the most informative (closest) instance is done through the entire unseen dataset. Each iteration of active learning involves the recomputation of the distances of each instance to the new hyperplane. Thus, for large datasets, searching the entire training set is very time-consuming and computationally expensive.
We propose a selection method which will not necessitate a full search through the entire dataset but locates an approximate most informative sample by examining a small constant number of randomly chosen samples. The method picks L (L # training instances) random training samples in each iteration and selects the best (closest to the hyperplane) among them. Suppose, instead of picking the closest instance among all the training samples XN = (x1, x2, · · · , xN) at each iteration, we first pick a random subset XL, L N and select the closest sample xi from XL based on the condition that xi is among the top p% closest instances in XN with probability (1− η). Any numerical modification to these constraints can be met by varying the size of L, and is independent of N . To demonstrate, the probability that at least one of the L instances is among the closest p% is 1 − (1 − p%)L. Due to the requirement of (1 − η) probability, we have
1 − (1 − p%)L = 1 − η (1) which follows the solution of L in terms of η and p
L = log η / log(1 − p%) (2) For example, the active learner will pick one instance, with 95% probability, that is among the top 5% closest instances to the hyperplane, by randomly sampling only log(.05)/ log(.95) = 59 instances regardless of the training set size. This approach scales well since the size of the subset L is independent of the training set size N , requires significantly less training time and does not have an adverse effect on the classification performance of the learner. In our experiments, we set L = 59.
Early Stopping: In SVM learning the classification boundary (hyperplane) is only determined by support vectors. This means that there is no point of adding new instances to the model after the
