	ref_title	ref_context	ref_entry	abstract	intro	ref_link
211	The case against accuracy estimation for comparing induction algorithms	['<NO>) in classification tasks, but for regression problems.', '<NO>) and may even require specific modeling techniques (e.', 'One reason for choosing to compare models with respect to AUC instead of accuracy is that the former is not sensitive to differences between the class distribution of the training examples and of the examples on which the model is applied <NO>.', 'In addition, the costs associated with true versus false prediction of positives and negatives are often asymmetric <NO> and are routinely used to guide the parameterisation and selection process of a wide range of classifiers, e.', '<NO> propose an alternative averaging 0 0.', 'Many representative works on the ineffectiveness of accuracy in the imbalanced learning scenario exist in the community <NO>, <NO>, <NO>, <NO>, <NO>, <NO>, <NO>, <NO>.']	Foster J Provost, Tom Fawcett, and Ron Kohavi. 1998. The case against accuracy estimation for comparing induction algorithms. ICML’98: Proc. of the 15th Int. Conf. on Machine Learning. Morgan Kaufmann Publishers, 445–453.			https://doi.org/10.5555/645527.657469
212	Learning from imbalanced data: Evaluation matters	[]	Troy Raeder, George Forman, and Nitesh V. Chawla. 2012. Learning from imbalanced data: Evaluation matters. Data Mining: Foundations and Intelligent Paradigms. Springer, 315–331.			http://scholar.google.com/scholar?hl=en&q=Troy+Raeder%2C+George+Forman%2C+and+Nitesh+V.+Chawla.+2012.+Learning+from+imbalanced+data%3A+Evaluation+matters.+In+Data+Mining%3A+Foundations+and+Intelligent+Paradigms.+Springer%2C+315%2D%2D331.
213	SMOTE-RSB*: A hybrid preprocessing approach based on oversampling and undersampling for high imbalanced data-sets using SMOTE and rough sets theory	[]	Enislay Ramentol, Yailé Caballero, Rafael Bello, and Francisco Herrera. 2012. SMOTE-RSB*: A hybrid preprocessing approach based on oversampling and undersampling for high imbalanced data-sets using SMOTE and rough sets theory. Knowl. Inform. Syst. 33, 2 (2012), 245–265.			http://scholar.google.com/scholar?hl=en&q=Enislay+Ramentol%2C+Yail%C3%A9+Caballero%2C+Rafael+Bello%2C+and+Francisco+Herrera.+2012a.+SMOTE-RSB%26ast%3B%3A+A+hybrid+preprocessing+approach+based+on+oversampling+and+undersampling+for+high+imbalanced+data-sets+using+SMOTE+and+rough+sets+theory.+Knowl.+Inform.+Syst.+33%2C+2+%282012%29%2C+245%2D%2D265.
214	SMOTE-FRST: A new resampling method using fuzzy rough set theory	[]	Enislay Ramentol, Nelle Verbiest, Rafael Bello, Yailé Caballero, Chris Cornelis, and Francisco Herrera. 2012. SMOTE-FRST: A new resampling method using fuzzy rough set theory. 10th International FLINS Conference on Uncertainty Modelling in Knowledge Engineering and Decision Making (to Appear).			http://scholar.google.com/scholar?hl=en&q=Enislay+Ramentol%2C+Nelle+Verbiest%2C+Rafael+Bello%2C+Yail%C3%A9+Caballero%2C+Chris+Cornelis%2C+and+Francisco+Herrera.+2012b.+SMOTE-FRST%3A+A+new+resampling+method+using+fuzzy+rough+set+theory.+In+10th+International+FLINS+Conference+on+Uncertainty+Modelling+in+Knowledge+Engineering+and+Decision+Making+%28to+Appear%29.
215	Optimized precision-a new measure for classifier performance evaluation	[]	Romesh Ranawana, and Vasile Palade. 2006. Optimized precision-a new measure for classifier performance evaluation. IEEE Congress on Evolutionary Computation, 2006. CEC 2006. IEEE, 2254–2261.			http://scholar.google.com/scholar?hl=en&q=Romesh+Ranawana+and+Vasile+Palade.+2006.+Optimized+precision-a+new+measure+for+classifier+performance+evaluation.+In+IEEE+Congress+on+Evolutionary+Computation%2C+2006.+CEC+2006.+IEEE%2C+2254%2D%2D2261.
216	Extreme re-balancing for SVMs: A case study	['There have been some recent works in improving the classification performance of SVMs on unbalanced data sets <NO>–<NO>.', 'Raskutti and Kowalczyk <NO> demonstrated that a one-class SVM that learned only from the minority class can sometimes perform better than an SVM modeled from two classes.', 'One-class SVM actually performs worse in many cases compared with a standard twoclass SVM <NO>.', 'While there are some recent papers on SVM for imbalanced classification <NO>–<NO>, <NO>, the application of SVM is still not completely explored, particularly the realm of undersampling of SVs.', 'Another technique suggested for class imbalance problem is to use a recognition-based, instead of discrimination-based inductive learning <NO>.', 'The effects of imbalanced data on SVMs exploit inadequacies of the soft-margin maximization paradigm <NO>, <NO>.', 'In this case, it might occur that the support vectors representing the minority concept are “far away” from this “ideal” line, and as a result, will contribute less to the final hypothesis <NO>, <NO>, <NO>.', '<NO> consider both sampling and dataspace weighting', 'Representative works in this area include the one-class SVMs <NO>, <NO>, <NO>, <NO>, <NO>, <NO> and the autoassociator (or autoencoder) method <NO>, <NO>, <NO>, <NO>.', 'Specifically, Raskutti and Kowalcyzk <NO> suggested that one-class learning is particularly useful in dealing with extremely imbalanced data sets with high feature space dimensionality.', 'Support vector machines have also utilized this same approach to learn rare classes, with some success <NO>.']	Bhavani Raskutti, and Adam Kowalczyk. 2004. Extreme re-balancing for SVMs: A case study. ACM SIGKDD Explor. Newslett. 6, 1 (2004), 60–69.			https://doi.org/10.1145/1007730.1007739
217	Utility-based Regression	[]	Rita P. Ribeiro. 2011. Utility-based Regression. Ph.D. Dissertation. Dep. Computer Science, Faculty of Sciences, University of Porto.			http://scholar.google.com/scholar?hl=en&q=Rita+P.+Ribeiro.+2011.+Utility-based+Regression.+Ph.D.+Dissertation.+Dep.+Computer+Science%2C+Faculty+of+Sciences%2C+University+of+Porto.
218	Predicting harmful algae blooms	['harmful algae blooms in rivers <NO>), or the prediction of unusual high (low) returns in financial quote data.']	Rita P. Ribeiro, and Luı́s Torgo 2003. Predicting harmful algae blooms. In Progress in Artificial Intelligence			http://scholar.google.com/scholar?hl=en&q=Rita+P.+Ribeiro+and+Lu%C3%ADs+Torgo.+2003.+Predicting+harmful+algae+blooms.+In+Progress+in+Artificial+Intelligence.+Springer%2C+308%2D%2D312.
219	Information Retrieval	['F1 has been widely used in information retrieval, which is: 2·TP 2·TP+FP+FN <NO>.', '0, attach different weights to precision(p) and recall(r) <NO>:', 'To measure the performance, we use both precision (p) and recall (r) in their combined from F1 : 2pr p+r <NO>.']	Cornelis V. Rijsbergen. 1979. Information Retrieval. Dept. of Computer Science, University of Glasgow, 2nd edition. (1979).			http://scholar.google.com/scholar?hl=en&q=Edward+Y.+Chang%2C+Beitao+Li%2C+Gang+Wu%2C+and+Kingshy+Goh.+2003.+Statistical+learning+for+effective+visual+information+retrieval.+In+ICIP+%283%29.+609%2D%2D612.
220	Disturbing neighbors ensembles of trees for imbalanced data	[]	Juan J. Rodrı́guez, José-Francisco Dı́ez-Pastor, Jesús Maudes, and César Garcı́a-Osorio 2012. Disturbing neighbors ensembles of trees for imbalanced data. In 2012 11th International Conference on Machine Learning and Applications (ICMLA),	Disturbing Neighbors (DN ) is a method for generating classifier ensembles. Moreover, it can be combined with any other ensemble method, generally improving the results. This paper considers the application of these ensembles to imbalanced data: classification problems where the class proportions are significantly different. DN ensembles are compared and combined with Bagging, using three tree methods as base classifiers: conventional decision trees (C4.5), Hellinger distance decision trees (HDDT) —a method designed for imbalance data— and model trees (M5P) —trees with linear models at the leaves—. The methods are compared using two collections of imbalanced datasets, with 20 and 66 datasets, respectively. The best results are obtained combining Bagging and DN , using conventional decision trees. 	"As many other ensemble methods (e.g., Bagging, Random Subspaces) the Disturbing Neighbors (DN ) method is based on training each base classifier with a random transformation of the dataset.
In this method, the transformation adds new attributes. These attributes are obtained from a small sample of randomly selected training examples. These examples are called the Disturbing Neighbors.
The additional attributes are based on which one of the Disturbing Neighbors is the nearest. The first added attribute is nominal, the possible values are the class labels. For a binary class data set, the attribute will be binary. For a given example, the value of this attribute is the class label of the nearest Disturbing Neighbor.
For each Disturbing Neighbor an additional boolean attribute is included. The value of the attribute is true for a given example if the corresponding Disturbing Neighbor is the nearest one.
As an additional source of diversity (a necessary ingredient of successful ensembles) for each base classifier the distances are calculated in a random subspace. This random subspace is only used for determining the nearest Disturbing Neighbor, the transformed dataset contains all the original attributes.
It is possible to obtain ensembles using only the DN method, but usually is possible to obtain better results combining DN with other ensemble methods. The combination generally is better than the other ensemble method and the DN ensemble <NO>.
In Figure 1 the tree at the right was obtained with the same method and from the same dataset (glass4) as the other trees but with the additional attributes from the Disturbing Neighbors. One of this attributes, Nearest 8, was selected as the root of the tree. This attribute indicates if the nearest DN is the eighth.
From the considered sources of diversity, in <NO> it was determined that for non particularly imbalanced data sets the most important source was the use of the boolean features, the impact of the nominal feature and the calculation of the distances in a random subspace were less important."	https://doi.org/10.1109/ICMLA.2012.181
221	SMOTE–IPF: Addressing the noisy and borderline examples problem in imbalanced classification by a re-sampling method with filtering	[]	José A. Sáez, Julián Luengo, Jerzy Stefanowski, and Francisco Herrera. 2015. SMOTE–IPF: Addressing the noisy and borderline examples problem in imbalanced classification by a re-sampling method with filtering. Inform. Sci. 291 (2015), 184–203.			https://doi.org/10.1016/j.ins.2014.08.051
222	Empirical analysis of assessments metrics for multi-class imbalance learning on the back-propagation context	[]	Juan Pablo Sánchez-Crisostomo, Roberto Alejo, Erika López-González, Rosa Marı́a Valdovinos, and J. Horacio Pacheco-Sánchez 2014. Empirical analysis of assessments metrics for multi-class imbalance learning on the back-propagation context. In Advances in Swarm Intelligence			http://scholar.google.com/scholar?hl=en&q=Juan+Pablo+S%C3%A1nchez-Crisostomo%2C+Roberto+Alejo%2C+Erika+L%C3%B3pez-Gonz%C3%A1lez%2C+Rosa+Mar%C3%ADa+Valdovinos%2C+and+J.+Horacio+Pacheco-S%C3%A1nchez.+2014.+Empirical+analysis+of+assessments+metrics+for+multi-class+imbalance+learning+on+the+back-propagation+context.+In+Advances+in+Swarm+Intelligence.+Springer%2C+17%2D%2D23.
223	Evolutionary ordinal extreme learning machine	[]	Javier Sánchez-Monedero, Pedro Antonio Gutiérrez, and Cesar Hervás-Martı́nez 2013. Evolutionary ordinal extreme learning machine. In Hybrid Artificial Intelligent Systems			http://scholar.google.com/scholar?hl=en&q=Javier+S%C3%A1nchez-Monedero%2C+Pedro+Antonio+Guti%C3%A9rrez%2C+and+Cesar+Herv%C3%A1s-Mart%C3%ADnez.+2013.+Evolutionary+ordinal+extreme+learning+machine.+In+Hybrid+Artificial+Intelligent+Systems.+Springer%2C+500%2D%2D509.
224	Estimating the support of a high-dimensional distribution	['Representative works in this area include the one-class SVMs <NO>, <NO>, <NO>, <NO>, <NO>, <NO> and the autoassociator (or autoencoder) method <NO>, <NO>, <NO>, <NO>.', 'Yet another example of a OC classifier is the OC Support Vector Machine (OCSVM) <NO>.']	Bernhard Schölkopf, John C. Platt, John Shawe-Taylor, Alex J. Smola, and Robert C. Williamson. 2001. Estimating the support of a high-dimensional distribution. Neur. Comput. 13, 7 (2001), 1443–1471.			https://doi.org/10.1162/089976601750264965
225	An empirical study of the classification performance of learners on imbalanced and noisy software quality data	[]	Chris Seiffert, Taghi M. Khoshgoftaar, Jason Van Hulse, and Andres Folleco. 2011. An empirical study of the classification performance of learners on imbalanced and noisy software quality data. Inform. Sci. (2011).			https://doi.org/10.1016/j.ins.2010.12.016
226	RUSBoost: A hybrid approach to alleviating class imbalance	['On the other hand, with regard to ensemble learning methods, a large number of different approaches have been proposed in the literature, including but not limited to SMOTEBoost <NO>, RUSBoost <NO>, IIVotes <NO>, EasyEnsemble <NO>, or SMOTEBagging <NO>.', 'have arisen as a possible solution to the class imbalance problem attracting great interest among researchers <NO>, <NO>, <NO>, <NO>.', 'Inside this family, we include SMOTEBoost <NO>, MSMOTEBoost <NO>, RUSBoost <NO>, and DataBoost-IM <NO> algorithms.', ', Bagging, Boosting) has given good results <NO>, <NO>, <NO>.']	Chris Seiffert, Taghi M. Khoshgoftaar, Jason Van Hulse, and Amri Napolitano. 2010. RUSBoost: A hybrid approach to alleviating class imbalance. IEEE Trans.Syst. Man Cybernet. A 40, 1 (2010), 185–197.	Class imbalance is a problem that is common to many application domains. When examples of one class in a training data set vastly outnumber examples of the other class(es), traditional data mining algorithms tend to create suboptimal classification models. Several techniques have been used to alleviate the problem of class imbalance, including data sampling and boosting. In this paper, we present a new hybrid sampling/boosting algorithm, called RUSBoost, for learning from skewed training data. This algorithm provides a simpler and faster alternative to SMOTEBoost, which is another algorithm that combines boosting and data sampling. This paper evaluates the performances of RUSBoost and SMOTEBoost, as well as their individual components (random undersampling, synthetic minority oversampling technique, and AdaBoost). We conduct experiments using 15 data sets from various application domains, four base learners, and four evaluation metrics. RUSBoost and SMOTEBoost both outperform the other procedures, and RUSBoost performs comparably to (and often better than) SMOTEBoost while being a simpler and faster technique. Given these experimental results, we highly recommend RUSBoost as an attractive alternative for improving the classification performance of learners built using imbalanced data.	"Much research has been performed with respect to the class imbalance problem. Weiss <NO> provides a survey of the class imbalance problem and techniques for reducing the negative impact imbalance that has on classification performance. The study identifies many methods for alleviating the problem of class imbalance, including data sampling and boosting, which are the two techniques investigated in this paper. Japkowicz <NO> presents another study addressing the issue of class imbalance, including an investigation of the types of imbalance that most negatively impact classification performance, and a small case study comparing several techniques for alleviating the problem.
Data sampling has received much attention in research related to class imbalance. Data sampling attempts to overcome imbalanced class distributions by adding examples to (oversampling) or removing examples from (undersampling) the data set. The simplest form of undersampling is RUS. RUS randomly removes examples from the majority class until a desired class distribution is found. While there is no universally accepted optimal class distribution, a balanced (50 : 50) distribution is often considered to be near optimal <NO>. However, when
examples from the minority class are very rare, a ratio closer to 35 : 65 (minority:majority) may result in better classification performance <NO>.
In addition to random data sampling techniques, several more “intelligent” algorithms for resampling data have been proposed. Barandela et al. <NO> and Han et al. <NO> examine the performance of some of these “intelligent” data sampling techniques, such as SMOTE, borderline SMOTE, and Wilson’s editing. Van Hulse et al. <NO> examine the performance of seven different data sampling techniques (both “intelligent” and random) using a large number of different learning algorithms and experimental data sets, finding both RUS and SMOTE to be very effective data sampling techniques.
Another technique for dealing with class imbalance is boosting. While boosting is not specifically designed to handle the class imbalance problem, it has been shown to be very effective in this regard <NO>. The most commonly used boosting algorithm is AdaBoost <NO>, which has been shown to improve the performance of any weak classifier, provided that the classifier results in better performance than random guessing. Several variations have been proposed to make AdaBoost cost sensitive <NO>–<NO> or to improve its performance on imbalanced data <NO>–<NO>. One of the most promising of these techniques is SMOTEBoost <NO>. SMOTEBoost combines an intelligent oversampling technique (SMOTE) with AdaBoost, resulting in a highly effective hybrid approach to learning from imbalanced data. Our proposed technique, which is RUSBoost, is based on the SMOTEBoost algorithm but provides a faster and simpler alternative for learning from imbalanced data with performance that is usually as good (and often better) than that of SMOTEBoost.
Closely related to the issue of class imbalance is costsensitive learning. Weiss et al. <NO> compare the performances of oversampling, undersampling, and cost-sensitive learning when dealing with data that have both an imbalanced class distribution and unequal error costs. Sun et al. <NO> present an in-depth examination of cost-sensitive boosting. Chawla et al. <NO> perform a detailed evaluation of a wrapper-based sampling approach to minimize misclassification cost. A detailed evaluation of RUSBoost as a cost-sensitive learning technique, including a comparison to existing methodologies, is left as a future work."	https://doi.org/10.1109/TSMCA.2009.2029559
227	Clustering based one-class classification for compliance verification of the comprehensive nuclear-test-ban treaty	[]	Shiven Sharma, Colin Bellinger, and Nathalie Japkowicz. 2012. Clustering based one-class classification for compliance verification of the comprehensive nuclear-test-ban treaty. Advances in Artificial Intelligence. Springer, 181–193.			https://doi.org/10.1007/978-3-642-30353-1_16
228	Evaluating and tuning predictive data mining models using receiver operating characteristic curves	[]	Atish P. Sinha, and Jerrold H. May. 2004. Evaluating and tuning predictive data mining models using receiver operating characteristic curves. J. Manag. Inform. Syst. 21, 3 (2004), 249–280.			https://doi.org/10.1080/07421222.2004.11045815
229	Learning from imbalanced data using ensemble methods and cluster-based undersampling	[]	Parinaz Sobhani, Herna Viktor, and Stan Matwin. 2014. Learning from imbalanced data using ensemble methods and cluster-based undersampling. New Frontiers in Mining Complex Patterns. Springer, 69–83.			http://scholar.google.com/scholar?hl=en&q=Parinaz+Sobhani%2C+Herna+Viktor%2C+and+Stan+Matwin.+2014.+Learning+from+imbalanced+data+using+ensemble+methods+and+cluster-based+undersampling.+In+New+Frontiers+in+Mining+Complex+Patterns.+Springer%2C+69%2D%2D83.
230	A systematic analysis of performance measures for classification tasks	[]	Marina Sokolova, and Guy Lapalme. 2009. A systematic analysis of performance measures for classification tasks. Inform. Process. Manag. 45, 4 (2009), 427–437.			https://doi.org/10.1016/j.ipm.2009.03.002
231	An improved AdaBoost algorithm for unbalanced classification data	[]	Jie Song, Xiaoling Lu, and Xizhi Wu. 2009. An improved AdaBoost algorithm for unbalanced classification data. Sixth International Conference on Fuzzy Systems and Knowledge Discovery, 2009. FSKD’09. Vol. 1. IEEE, 109–113.	AdaBoost algorithm is proved to be a very efficient classification method for the balanced dataset with all classes having similar proportions. However, in real application, it is quite common to have unbalanced dataset with a certain class of interest having very small size. It will be problematic since the algorithm might predict all the cases into majority classes without loss of overall accuracy. This paper proposes an improved AdaBoost algorithm called BABoost (Balanced AdaBoost), which gives higher weights to the misclassified examples from the minority class. Empirical results show that the new method decreases the prediction error of minority class significantly with increasing the prediction error of majority class a little bit. It can also produce higher values of margin which indicates a better classification method	"In this paper, we propose a new algorithm called BABoost based on dividing the overall misclassification error into several parts. We want to utilize BABoost to improve the accuracy over the minority class without much sacrificing the accuracy over the majority class.
Adaboost algorithm gives equal weight to each misclassified example. But the misclassification error of each class is not same. Generally, the misclassification error of the minority class will larger than the majority’s. So Adaboost algorithm will lead to higher bias and smaller margin when encountering skew distribution. Our goal is to reduce the bias of Adaboost algorithm and increase the margin between each two classes. The proposed BABoost algorithm (Figure 1) in each round of boosting assigns more weights to the misclassified examples, especially those in the minority class. More generally, we focus on multiclass (J-class) problems in which in this paper. Following Schapire and Singer’s <NO>, <NO> approach to multiclass problems, we change the multiclass problem into two-class problems. That is, if equals , we set it equal to a 1 by vector with the element as +1 and -1 for others; if equals , then it equals a 1 by J-1 vector with all elements as -1. D denotes the resampling probabilities for each case and H is the matrix for the ensemble predictor.
The differences between BABoost and Adaboost are the calculation of , , and the update of the H. indicates the prediction error for the predictor when predicting the cases into the class. is the weight for the
predictor and class. For example, instead of the overall error in the AdaBoost, it will be two within group prediction errors: and for binary problems.
Except that and will lead to different weights to majority class and minority class, also give a strong impact to reweight the distribution of samples. Different class corresponds to its own . The value of should be positive and larger for majority class, smaller for minority class in order to emphasize more on minority class: The larger the is, the smaller the is. So the corresponding misclassified objects of the class get lower weights."	https://doi.org/10.1109/FSKD.2009.608
232	SMOUTE: Synthetics minority over-sampling and under-sampling techniques for class imbalanced problem	[]	Panote Songwattanasiri, and Krung Sinapiromsaran. 2010. SMOUTE: Synthetics minority over-sampling and under-sampling techniques for class imbalanced problem. Proceedings of the Annual International Conference on Computer Science Education: Innovation and Technology, Special Track: Knowledge Discovery. 78–83.			http://scholar.google.com/scholar?hl=en&q=Panote+Songwattanasiri+and+Krung+Sinapiromsaran.+2010.+SMOUTE%3A+Synthetics+minority+over-sampling+and+under-sampling+techniques+for+class+imbalanced+problem.+In+Proceedings+of+the+Annual+International+Conference+on+Computer+Science+Education%3A+Innovation+and+Technology%2C+Special+Track%3A+Knowledge+Discovery.+78%2D%2D83.
233	Dealing with data difficulty factors while learning from imbalanced data	[]	Jerzy Stefanowski. 2016. Dealing with data difficulty factors while learning from imbalanced data. Challenges in Computational Statistics and Data Mining. Springer, 333–363.			http://scholar.google.com/scholar?hl=en&q=Jerzy+Stefanowski.+2016.+Dealing+with+data+difficulty+factors+while+learning+from+imbalanced+data.+In+Challenges+in+Computational+Statistics+and+Data+Mining.+Springer%2C+333%2D%2D363.
234	Selective pre-processing of imbalanced data for improving classification performance	['Many works have been developed studying the suitability of data preprocessing techniques to deal with imbalanced data-sets <NO>, <NO>, <NO>.', '2) Data level (or external) approaches rebalance the class distribution by resampling the data space <NO>, <NO>, <NO>,', '5) Selective preprocessing of imbalanced data (SPIDER) <NO>: It combines local oversampling of the minority class with filtering difficult examples from the majority class.']	Jerzy Stefanowski, and Szymon Wilk. 2008. Selective pre-processing of imbalanced data for improving classification performance. Data Warehousing and Knowledge Discovery. Springer, 283–292.			https://doi.org/10.1007/978-3-540-85836-2_27
