	ref_title	ref_context	ref_entry	abstract	intro	ref_link
generalize inductive rules over the sample space when presented with this form of imbalance. In this case, the combination of small sample size and high dimensionality hinders learning because of difficultly involved in forming conjunctions over the high degree of features with limited samples. If the sample space is sufficiently large enough, a set of general (albeit complex) inductive rules can be defined for the dataspace. However, when samples are limited, the rules formed can become too specific, leading to overfitting. In regards to learning from such data sets, this is a relatively new research topic that requires much needed attention in the community. As a result, we will touch upon this topic again later in our discussions."	https://doi.org/10.1145/1007730.1007733
140	Imbalanced Learning: Foundations, Algorithms, and Applications	[]	Haibo He, and Yunqian Ma. 2013. Imbalanced Learning: Foundations, Algorithms, and Applications. John Wiley & Sons.			http://scholar.google.com/scholar?hl=en&q=Josh+Attenberg+and+Seyda+Ertekin.+2013.+Class+imbalance+and+active+learning.+In+Imbalanced+Learning%3A+Foundations%2C+Algorithms%2C+and+Applications%2C+Haibo+He+and+Yunqian+Ma+%28Eds.%29.+John+Wiley+%26+Sons.
141	Soft (gaussian CDE) regression models and loss functions	[]	José Hernández-Orallo. 2012. Soft (gaussian CDE) regression models and loss functions. arXiv Preprint arXiv:1211.1043 (2012).			http://scholar.google.com/scholar?hl=en&q=Jos%C3%A9+Hern%C3%A1ndez-Orallo.+2012.+Soft+%28gaussian+CDE%29+regression+models+and+loss+functions.+arXiv+Preprint+arXiv%3A1211.1043+%282012%29.
142	ROC} curves for regression	[]	José Hernández-Orallo. 2013. ROC} curves for regression. Pattern Recogn. 46, 12 (2013), 3395–3411. DOI:http://dx.doi.org/10.1016/j.patcog.2013.06.014			https://doi.org/10.1016/j.patcog.2013.06.014
143	Probabilistic reframing for cost-sensitive regression	[]	José Hernández-Orallo. 2014. Probabilistic reframing for cost-sensitive regression. ACM Trans. Knowl. Discov. Data 8, 4, Article 17 (Aug. 2014), 55 pages. DOI:http://dx.doi.org/10.1145/2641758			https://doi.org/10.1145/2641758
144	A unified view of performance metrics: Translating threshold choice into expected classification loss	[]	José Hernández-Orallo, Peter Flach, and César Ferri. 2012. A unified view of performance metrics: Translating threshold choice into expected classification loss. J. Mach. Learn. Res. 13, 1 (2012), 2813–2869.			https://doi.org/10.5555/2503308.2503332
145	Concept learning and the problem of small disjuncts	['However, imbalance learning problems pose a great challenge to the classifier as it becomes very hard to learn the minority class samples <NO>, <NO>, <NO>.', 'This kind of oversampling sometimes creates very specific rules, leading to overfitting <NO>.', 'Furthermore, the minority concept may additionally contain a subconcept with limited instances, amounting to diverging degrees of classification difficulty <NO>, <NO>.', 'Briefly, the problem of small disjuncts can be understood as follows: A classifier will attempt to learn a concept by creating multiple disjunct rules that describe the main concept <NO>, <NO>, <NO>.', ', rules that cover a small cluster of examples pertaining to the main concept, arise as a direct result of underrepresented subconcepts <NO>, <NO>, <NO>.', 'However, this commonality is only superficial, each method introduces its own set of problematic consequences that can potentially hinder learning <NO>, <NO>, <NO>.', 'In particular, overfitting in oversampling occurs when classifiers produce multiple clauses in a rule for multiple copies of the same example which causes the rule to become too specific; although the training accuracy will be high in this scenario, the classification performance on the unseen testing data is generally far worse <NO>.', 'Small disjuncts are those disjuncts in the learned classifier that cover few training examples <NO>.', ', small disjuncts) generally have a much higher error rate than large disjuncts <NO>.', 'If a data set has two classes and an equal number of training examples in each, then a disjunct is 99% significant if and only if it covers at least 7 training examples <NO>.', 'Empirical results <NO> show that the strategy of eliminating all small disjuncts results in an increase in overall error rate and hence is not a good strategy.', 'Volume 6, Issue 1 - Page 10 Consider a learner with a maximum-generality bias <NO>.', 'Unfortunately, this approach was shown not only to degrade performance with respect to rarity, but also to degrade overall classification performance <NO>.', 'Holte, Acker and Porter <NO> changed the bias of an existing learner, CN2, to make the bias more specific.']	Robert C. Holte, Liane E. Acker, and Bruce W. Porter. 1989. Concept learning and the problem of small disjuncts. IJCAI, Vol. 89. Citeseer, 813–818.			https://doi.org/10.5555/1623755.1623884
146	Active learning for imbalance problem using L-GEM of RBFNN	[]	Junjie Hu. 2012. Active learning for imbalance problem using L-GEM of RBFNN. ICMLC. 490–495.			http://scholar.google.com/scholar?hl=en&q=Junjie+Hu.+2012.+Active+learning+for+imbalance+problem+using+L-GEM+of+RBFNN.+In+ICMLC.+490%2D%2D495.
147	MSMOTE: Improving classification performance when training data is imbalanced	['4) Modified synthetic minority oversampling technique (MSMOTE) <NO>: It is a modified version of SMOTE.', 'Inside this family, we include SMOTEBoost <NO>, MSMOTEBoost <NO>, RUSBoost <NO>, and DataBoost-IM <NO> algorithms.']	Shengguo Hu, Yanfeng Liang, Lintao Ma, and Ying He. 2009. MSMOTE: Improving classification performance when training data is imbalanced. Second International Workshop on Computer Science and Engineering, 2009. WCSE’09, Vol. 2. IEEE, 13–17.			https://doi.org/10.5555/1681514.1682710
148	Learning classifiers from imbalanced data based on biased minimax probability machine	['to adapt a boosting algorithm to cost-sensitive problems is to change the weights of the weak classifiers in forming the final ensemble classifier, such as BMPM <NO> and LAC <NO>.', 'Further improvements are possible by learning αi,j , as shown in <NO> and <NO>.', 'Algorithmic methods include adjusting the costs associated with misclassification so as to improve performance <NO>, shifting the bias of a classifier to favor the rare class <NO>, creating Adaboost-like boosting schemes <NO>, and learning from one class <NO>.']	Kaizhu Huang, Haiqin Yang, Irwin King, and Michael R. Lyu. 2004. Learning classifiers from imbalanced data based on biased minimax probability machine. Proceedings of the 2004 IEEE Computer Society Conference on Computer Vision and Pattern Recognition, 2004. CVPR 2004. Vol. 2. IEEE, II–558.			https://doi.org/10.5555/1896300.1896381
149	A new weighted approach to imbalanced data classification problem via support vector machine with quadratic cost function	[]	Jae Pil Hwang, Seongkeun Park, and Euntai Kim. 2011. A new weighted approach to imbalanced data classification problem via support vector machine with quadratic cost function. Expert Syst. Appl. 38, 7 (2011), 8580–8585.			https://doi.org/10.1016/j.eswa.2011.01.061
150	z-SVM: An SVM for improved classification of imbalanced data	['For training SVMs with imbalanced dataset, there exist algorithmic techniques, such as Different Error Cost (DEC) <NO> and zSVM <NO>.', 'zSVM is another algorithmic modification, which is proposed for SVMs in <NO> for learning-imbalance datasets.', 'In <NO>, the value of z, which gives the best prediction for the training dataset, was selected as the optimal value of z to be used in (12).']	Tasadduq Imam, Kai Ming Ting, and Joarder Kamruzzaman. 2006. z-SVM: An SVM for improved classification of imbalanced data. AI 2006: Advances in Artificial Intelligence. Springer, 264–273.			https://doi.org/10.1007/11941439_30
151	Learning from imbalanced data sets: A comparison of various strategies	[', (Drummond & Holte, 2003), (Kubat & Matwin, 1997), (Maloof, 2003), (Japkowicz, 2000), (Weiss & Provost, 2003), (Chawla et al.', 'According to <NO>, the number of synthetic samples to be generated is set to 200 percent of the original minority class samples.', 'Japkowicz <NO> presents another study addressing the issue of class imbalance, including an investigation of the types of imbalance that most negatively impact classification performance, and a small case study comparing several techniques for alleviating the problem.', 'Many researchers, suach as Batista, G <NO>, Estabrooks <NO> and Japkowicz <NO>, proposes various approach about two resampling strategies.', 'On the other hand, these opportunities also raise many new challenges for the research community in general <NO>–<NO>.', 'Here we follow the suggestions of <NO>, <NO>, and <NO> and use the minority class as the positive class and majority class as the negative class.', 'The number of synthetic data generated at each boosting iteration is set to 200% of the number of the minority instances <NO>.', 'Representative works in this area include the one-class SVMs <NO>, <NO>, <NO>, <NO>, <NO>, <NO> and the autoassociator (or autoencoder) method <NO>, <NO>, <NO>, <NO>.', 'In <NO>, a comparison of different sampling methods and the one-class autoassociator method was presented, which provides useful suggestions about the advantages and limitations of both methods.', 'Recently, the class imbalance problem has been recognized as a crucial problem in machine learning and data mining because such a problem is encountered in a large number of domains and, in certain cases, it causes seriously negative effects on the performance of learning methods that assume a balanced distribution of classes <NO>, <NO>.', 'Although some studies have shown that oversampling is effective in learning with imbalanced data sets <NO>, <NO>, <NO>, it should be noted that oversampling usually increases the training time and may lead to overfitting since it involves making exact copies of examples <NO>, <NO>.', 'Nevertheless, some studies have shown that undersampling is effective in learning with imbalanced data sets <NO>, <NO>, <NO>, sometimes even stronger than oversampling, especially on large data sets <NO>, <NO>.', 'Nevertheless, some studies have shown that undersampling is effective in learning with imbalanced data sets <NO>, <NO>, <NO>, sometimes even stronger than oversampling, especially on large data sets <NO>, <NO>.', 'applied to multiclass problems <NO>, in fact, little work has']	Nathalie Japkowicz. 2000. Learning from imbalanced data sets: A comparison of various strategies. AAAI Workshop on Learning from Imbalanced Data Sets, Vol. 68. Menlo Park, CA.			http://scholar.google.com/scholar?hl=en&q=Nathalie+Japkowicz.+2000.+Learning+from+imbalanced+data+sets%3A+A+comparison+of+various+strategies.+In+AAAI+Workshop+on+Learning+from+Imbalanced+Data+Sets%2C+Vol.+68.+Menlo+Park%2C+CA.
152	Concept-learning in the presence of between-class and within-class imbalances	[]	Nathalie Japkowicz. 2001. Concept-learning in the presence of between-class and within-class imbalances. Advances in Artificial Intelligence. Springer, 67–77.			https://doi.org/10.5555/647462.726288
153	Class imbalances: Are we focusing on the right issue	['Japkowicz <NO> discussed about the cause for lower performance in standard classifiers is actually small disjuncts of within-class.', 'Moreover, in <NO> Japkowicz performed several experiments on artificial data sets and concluded that class imbalances do not seem to systematically cause performance degradation.']	Nathalie Japkowicz. 2003. Class imbalances: Are we focusing on the right issue. Workshop on Learning from Imbalanced Data Sets II, Vol. 1723. 63.			http://scholar.google.com/scholar?hl=en&q=Nathalie+Japkowicz.+2003.+Class+imbalances%3A+Are+we+focusing+on+the+right+issue.+In+Workshop+on+Learning+from+Imbalanced+Data+Sets+II%2C+Vol.+1723.+63.
154	Assessment metrics for imbalanced learning	[]	Natalie Japkowicz. 2013. Assessment metrics for imbalanced learning. Imbalanced Learning: Foundations, Algorithms, and Applications, Haibo He and Yunqian Ma (Eds.). John Wiley & Sons.			http://scholar.google.com/scholar?hl=en&q=Natalie+Japkowicz.+2013.+Assessment+metrics+for+imbalanced+learning.+In+Imbalanced+Learning%3A+Foundations%2C+Algorithms%2C+and+Applications%2C+Haibo+He+and+Yunqian+Ma+%28Eds.%29.+John+Wiley+%26+Sons.
155	A novelty detection approach to classification	['This becomes very costly when identification of the minority class samples is crucial <NO>, <NO>, <NO>, <NO>, <NO>, <NO>.', 'Another technique suggested for class imbalance problem is to use a recognition-based, instead of discrimination-based inductive learning <NO>.', 'Representative works in this area include the one-class SVMs <NO>, <NO>, <NO>, <NO>, <NO>, <NO> and the autoassociator (or autoencoder) method <NO>, <NO>, <NO>, <NO>.', 'One data mining system that utilizes this recognition-based approach is Hippo <NO>.']	Nathalie Japkowicz, Catherine Myers, and Mark Gluck. 1995. A novelty detection approach to classification. IJCAI. 518–523.			https://doi.org/10.5555/1625855.1625923
156	Evaluating Learning Algorithms: A Classification Perspective	[]	Nathalie Japkowicz, and Mohak Shah. 2011. Evaluating Learning Algorithms: A Classification Perspective. Cambridge University Press.			https://doi.org/10.5555/1964882
157	The class imbalance problem: A systematic study	['In <NO>, the authors reported that the error rate caused by imbalanced class distribution decreases when the number of examples of', 'Recently, reports from both academy and industry indicate that the imbalanced class distribution of a data set has posed a serious difficulty to most classifier learning algorithms which assume a relatively balanced distribution <NO>.', 'in what domains do class imbalances most hinder the performance of a standard classifier? <NO>; and 3) what are the possible solutions in dealing with the class imbalance problem? With regard to the first aspect, it is stated that accuracy is traditionally the most commonly used measure in both assessing the classification models and guiding the search algorithms.', 'With respect to the second aspect, a thorough study can be found in <NO>.', 'have been found to depreciate in the presence of within-class imbalance and small disjuncts problems <NO>, <NO>, <NO>.', 'the classifiers’ poor performance <NO>.', 'It has been shown that oversampling is lot more useful than undersampling and oversampling dramatically improves classifiers performance even for complex data <NO>.', 'Mining highly unbalanced data sets, particularly in a cost-sensitive environment, is among the leading challenges for knowledge discovery and data mining <NO>, <NO>.', '2) Most previous works use decision trees as the basic classifier <NO>.', 'Random undersampling was studied in <NO>, <NO>.', 'Attempts have been made to deal with this problem in diverse domains such as fraud detection <NO>, in-flight helicopter gearbox fault monitoring <NO>, and text categorization <NO>.', 'There is a significant body of research comparing the various sampling methods <NO>.', 'Recent research showed that oversampling at random does not help to improve prediction performance <NO> therefore we use a more complex oversampling Table 2: Overview of the datasets.', 'For example, the work on cost sensitive learning <NO> aimed at reducing total cost, and sampling approaches <NO> to favour the minority class are usually demonstrated with decision tree algorithms and/or naive Bayes.', 'Skewed data is transformed into partitions with more of the rarer examples and fewer of the common examples using the procedure known as minority oversampling with replacement/replication <NO>.', 'Indeed, there are at least three surveys of methods for improving classification performance on imbalanced datasets <NO>, <NO>, <NO>.', 'A possible explanation is that SVM frequently uses few support vectors to determine the separation between classes, as previously observed by <NO>.', 'On the other hand, Japkowicz and Stephen <NO> compare several methods of over and under-sampling on a series of artificial data sets and conclude that over-sampling is more effective than under-sampling at reducing error rate.', 'Some studies have shown that for certain relative imbalanced data sets, the minority concept is accurately learned with little disturbance from the imbalance <NO>, <NO>, <NO>.', 'The existence of within-class imbalances is closely intertwined with the problem of small disjuncts, which has been shown to greatly depreciate classification performance <NO>, <NO>, <NO>, <NO>.', 'In this case, imbalanced data sets exploit inadequacies in the splitting criterion at each node of the decision tree <NO>, <NO>, <NO>.', 'However, they do not imply that classifiers cannot learn from imbalanced data sets; on the contrary, studies have also shown that classifiers induced from certain imbalanced data sets are comparable to classifiers induced from the same data set balanced by sampling techniques <NO>, <NO>.', 'The representative kernel-based learning paradigm, support vector machines (SVMs), can provide relatively robust classification results when applied to imbalanced data sets <NO>.', 'A two-class data set is said to be imbalanced when one of the classes is heavily under-represented as regards the other class <NO>.', 'Many systems have used some variation of precision and recall to guide the data mining process and evaluate the end result <NO>.', 'However, a study that used artificial domains came to the opposite conclusion <NO>.', 'Sampling techniques have generated the most research in this area and there are a few studies <NO> that compare sampling methods.', 'This recommendation is also supported by research that shows that such methods outperform over-sampling and under-sampling <NO>.', 'Although some studies have shown that oversampling is effective in learning with imbalanced data sets <NO>, <NO>, <NO>, it should be noted that oversampling usually increases the training time and may lead to overfitting since it involves making exact copies of examples <NO>, <NO>.', 'Nevertheless, some studies have shown that undersampling is effective in learning with imbalanced data sets <NO>, <NO>, <NO>, sometimes even stronger than oversampling, especially on large data sets <NO>, <NO>.']	Nathalie Japkowicz, and Shaju Stephen. 2002. The class imbalance problem: A systematic study. Intell. Data Anal. 6, 5 (2002), 429–449.			https://doi.org/10.5555/1293951.1293954
158	Classification of imbalanced data by combining the complementary neural network and SMOTE algorithm	[]	Piyasak Jeatrakul, Kok Wai Wong, and Chun Che Fung. 2010. Classification of imbalanced data by combining the complementary neural network and SMOTE algorithm. Neural Information Processing. Models and Applications. Springer, 152–159.			https://doi.org/10.5555/1939751.1939773
159	Class imbalances versus small disjuncts	['Japkowicz <NO> discussed about the cause for lower performance in standard classifiers is actually small disjuncts of within-class.', 'have been found to depreciate in the presence of within-class imbalance and small disjuncts problems <NO>, <NO>, <NO>.', 'then the imbalance problem becomes very severe <NO>, <NO>.', 'Random oversampling is a nonheuristic method that adds samples through the random replication of the minority class samples <NO>, <NO>.', 'Regardless of the method used to counter the imbalance problem, factors such as the uncertainty of the true distribution between the samples of the minority class and majority class samples, complexity of data, and noise in data may pose a limit on the classifiers’ performance <NO>, <NO>, <NO>.', 'This, in fact, is the result of another form of imbalance, a within-class imbalance, which concerns itself with the distribution of representative data for subconcepts within a class <NO>, <NO>, <NO>.', 'The existence of within-class imbalances is closely intertwined with the problem of small disjuncts, which has been shown to greatly depreciate classification performance <NO>, <NO>, <NO>, <NO>.', 'In <NO>, the cluster-based oversampling (CBO) algorithm is proposed to effectively deal with the within-class imbalance problem in tandem with the between-class imbalance problem.', 'For instance, Jo and Japkowicz <NO> used the', 'A clustering-based sampling method has been proposed in <NO>, while a genetic algorithmbased sampling method has been proposed in <NO>.', 'cluster-based oversampling <NO>, Synthetic Minority Oversampling Technique (SMOTE) <NO>, and Borderline-SMOTE <NO>.', 'classes but also helps balance instance grouping within the two classes <NO>.']	Taeho Jo, and Nathalie Japkowicz. 2004. Class imbalances versus small disjuncts. ACM SIGKDD Explor. Newslett. 6, 1 (2004), 40–49.			https://doi.org/10.1145/1007730.1007737
160	Evaluating boosting algorithms to classify rare classes: Comparison and improvements	['way that they modify the weight update rule, among this family AdaCost <NO>, CSB1, CSB2 <NO>, RareBoost <NO>, AdaC1, AdaC2, and AdaC3 <NO> are the most representative approaches.', 'However, for a classification model induced from a data set with imbalanced class distribution, accuracy is no longer a proper measure since rare classes have very few impact on accuracy than prevalent classes <NO>.', 'Within the bi-class applications, some variants of the AdaBoost algorithm in tackling the imbalance problem are reported, such as AdaCost <NO>, CSB1 and CSB2 <NO>, RareBoost <NO> and AdaC1, AdaC2 and AdaC3 <NO>.', 'Several variations have been proposed to make AdaBoost cost sensitive <NO>–<NO> or to improve its performance on imbalanced data <NO>–<NO>.', 'Many representative works on the ineffectiveness of accuracy in the imbalanced learning scenario exist in the community <NO>, <NO>, <NO>, <NO>, <NO>, <NO>, <NO>, <NO>.']	Mahesh V. Joshi, Vipin Kumar, and Ramesh C. Agarwal. 2001. Evaluating boosting algorithms to classify rare classes: Comparison and improvements. Proceedings IEEE International Conference on Data Mining, 2001. ICDM 2001. IEEE, 257–264.			https://doi.org/10.5555/645496.658037
161	EUS SVMs: Ensemble of under-sampled SVMs for data imbalance problems	[]	Pilsung Kang, and Sungzoon Cho. 2006. EUS SVMs: Ensemble of under-sampled SVMs for data imbalance problems. Neural Information Processing. Springer, 837–846.			https://doi.org/10.1007/11893028_93
162	Learning with limited minority class data	['to 35 : 65 (minority:majority) may result in better classification performance <NO>.', 'Another experimental work is presented in <NO>.', 'An interesting feature of the experimental design used in <NO> is to allow the analysis of classification performance factorized by class rarity and class distribution.']	Taghi M. Khoshgoftaar, Chris Seiffert, Jason Van Hulse, Amri Napolitano, and Andres Folleco. 2007. Learning with limited minority class data. Sixth International Conference on Machine Learning and Applications, 2007. ICMLA 2007. IEEE, 348–353.			https://doi.org/10.1109/ICMLA.2007.64
163	Handling imbalanced datasets: A review	[]	Sotiris Kotsiantis, Dimitris Kanellopoulos, and Panayiotis Pintelas. 2006. Handling imbalanced datasets: A review. GESTS Int. Trans. Comput. Sci. Eng. 30, 1 (2006), 25–36.			http://scholar.google.com/scholar?hl=en&q=Sotiris+Kotsiantis%2C+Dimitris+Kanellopoulos%2C+and+Panayiotis+Pintelas.+2006.+Handling+imbalanced+datasets%3A+A+review.+GESTS+Int.+Trans.+Comput.+Sci.+Eng.+30%2C+1+%282006%29%2C+25%2D%2D36.
164	Mixture of expert agents for handling imbalanced data sets	[]	Sotiris Kotsiantis, and Panagiotis Pintelas. 2003. Mixture of expert agents for handling imbalanced data sets. Ann. Math. Comput. Teleinform. 1, 1 (2003), 46–55.			http://scholar.google.com/scholar?hl=en&q=Sotiris+Kotsiantis+and+Panagiotis+Pintelas.+2003.+Mixture+of+expert+agents+for+handling+imbalanced+data+sets.+Ann.+Math.+Comput.+Teleinform.+1%2C+1+%282003%29%2C+46%2D%2D55.
